{
  "schemaVersion": 1,
  "rubric": "requirement-fragment-semantic-v1",
  "source": {
    "planPath": "../requirements/analysis-plan.json",
    "planSha256": "ece89d76cc8979bb8ff3c4b80326d77880a565bde040849307d9bfcfe2ebf059"
  },
  "audits": [
    {
      "packetId": "RWP-0001",
      "fragmentSha256": "6ba77e52b38539dce9986921021387473017a012b61429173d9eb4e6fc48427d",
      "outcome": "accepted",
      "issues": []
    },
    {
      "packetId": "RWP-0002",
      "fragmentSha256": "3405148396b3e659808fde641eba4abaf527adc0ae973836698e4bf7208ce282",
      "outcome": "accepted",
      "issues": []
    },
    {
      "packetId": "RWP-0003",
      "fragmentSha256": "0d79633c83666a22ee016ca316c146a35c1ff17780422b1a2b9c93a4f3c463c2",
      "outcome": "accepted",
      "issues": []
    },
    {
      "packetId": "RWP-0004",
      "fragmentSha256": "aa350cd504a6458bf695f3513e06ecce31ee8e8259983125d83df055f639cc26",
      "outcome": "accepted",
      "issues": []
    },
    {
      "packetId": "RWP-0005",
      "fragmentSha256": "6737b4f03d52fe4ff05eba007305414259c849f71a9c03ed96092dd1effcd391",
      "outcome": "accepted",
      "issues": []
    },
    {
      "packetId": "RWP-0006",
      "fragmentSha256": "7dd110aa24702008302ed48c49d3f33f6fd63f7f0e21e27ec257fff079255dff",
      "outcome": "accepted",
      "issues": []
    },
    {
      "packetId": "RWP-0007",
      "fragmentSha256": "bf4b6e998ebc2fdc11a1230b548524bff1ecb1301728c28b019e812c85d36ad7",
      "outcome": "accepted",
      "issues": []
    },
    {
      "packetId": "RWP-0008",
      "fragmentSha256": "01cf2a1932cf4aaf2680b6b1f55f0548589eb21a18ca44adfec1d9fef4542041",
      "outcome": "accepted",
      "issues": []
    },
    {
      "packetId": "RWP-0009",
      "fragmentSha256": "459d614141666656c07e11171341f9bae77d7b1b8c26ab0239767bc2a9bb3eda",
      "outcome": "accepted",
      "issues": []
    },
    {
      "packetId": "RWP-0010",
      "fragmentSha256": "b302f701175d5338c29b4ca3b3dde54bd5b8d0c96abc70437a4bc46915fb970a",
      "outcome": "accepted",
      "issues": []
    },
    {
      "packetId": "RWP-0011",
      "fragmentSha256": "403a6d139801837c974bcd3c4f1f3f409d0eecac611d9988fe638e042e78f596",
      "outcome": "accepted",
      "issues": []
    },
    {
      "packetId": "RWP-0012",
      "fragmentSha256": "9d3411d58a81906e16fa37476dd5c886a97010afa479d66e04be73adaabc868a",
      "outcome": "accepted",
      "issues": []
    },
    {
      "packetId": "RWP-0013",
      "fragmentSha256": "78023b0e505291caa193306f084bb9941b82b2965db706e4d0557159cf40128c",
      "outcome": "accepted",
      "issues": []
    },
    {
      "packetId": "RWP-0014",
      "fragmentSha256": "e5f37b5293307e3c01e8aad497b2086f91a52f870d2ec6b44960adb66ab30ed0",
      "outcome": "accepted",
      "issues": []
    },
    {
      "packetId": "RWP-0015",
      "fragmentSha256": "e72579598f97fe90f88aac383832d0e266ebaa7b0e84c29726a2046e62e91f4a",
      "outcome": "accepted",
      "issues": []
    },
    {
      "packetId": "RWP-0016",
      "fragmentSha256": "1f15573e08226684cddb6c00050111093dcb5abdea565eb4cbfb681dbc0c875a",
      "outcome": "accepted",
      "issues": []
    },
    {
      "packetId": "RWP-0017",
      "fragmentSha256": "ae1a33e1d0ae32237096f5bbeed67dfbf75e7d0baaaa465f14f979c16b83afce",
      "outcome": "accepted",
      "issues": []
    },
    {
      "packetId": "RWP-0018",
      "fragmentSha256": "5cc4ad8260a3cd3fc86a8394f1699ca393056b6849fa4368cd944a8456ce5299",
      "outcome": "accepted",
      "issues": []
    },
    {
      "packetId": "RWP-0019",
      "fragmentSha256": "31d193eadbe8e275cda10db1966076dc08924b73fb87bc007c756a493c92a1f3",
      "outcome": "accepted",
      "issues": []
    },
    {
      "packetId": "RWP-0020",
      "fragmentSha256": "ebef111ae3c5e24a45ab2718b2d3c3748eaf5d45fcdca7d25122114acd62d8cd",
      "outcome": "accepted",
      "issues": []
    },
    {
      "packetId": "RWP-0021",
      "fragmentSha256": "58b19799a8b2415a917dd3afd6aeea080872a8ee9f5bd4698ccac0a9072b88d2",
      "outcome": "accepted",
      "issues": []
    },
    {
      "packetId": "RWP-0022",
      "fragmentSha256": "3a09a0a6f45181cb01485d47336074bc75a4e0f5a1c5b15ff34f6f8ef1f4b2a3",
      "outcome": "accepted",
      "issues": []
    },
    {
      "packetId": "RWP-0023",
      "fragmentSha256": "3131066cb5ede537a565d7858e630041139483e1cb049fa411c7e634981180c4",
      "outcome": "accepted",
      "issues": []
    },
    {
      "packetId": "RWP-0024",
      "fragmentSha256": "8876455a378341ba8cc066cfea9ced3ced4e404b25421369ae0a3e32f9c72c95",
      "outcome": "accepted",
      "issues": []
    },
    {
      "packetId": "RWP-0025",
      "fragmentSha256": "afb88322d3533259f301a14e31b09f2973aebd6c7961f9c03ac9c6588a820d7a",
      "outcome": "accepted",
      "issues": []
    },
    {
      "packetId": "RWP-0026",
      "fragmentSha256": "771a274c7b1bd28f110ef743fb411495d041e2a4426e98c04cd47e8808fc06b9",
      "outcome": "accepted",
      "issues": []
    },
    {
      "packetId": "RWP-0027",
      "fragmentSha256": "f11757e7586ef2683792ab2400a0d8b2b1fc60f5e8798552d7dfbe7a4c34e809",
      "outcome": "accepted",
      "issues": []
    },
    {
      "packetId": "RWP-0028",
      "fragmentSha256": "cc2e08c24c8dc1c84d5ab1f20cc301ea12d7158cdc0ec021f6687973a6866780",
      "outcome": "accepted",
      "issues": []
    },
    {
      "packetId": "RWP-0029",
      "fragmentSha256": "a1a22141fb271ea7af742c72d46661c6bcb0c6b70395f056276dc7f508b25bf9",
      "outcome": "accepted",
      "issues": []
    },
    {
      "packetId": "RWP-0030",
      "fragmentSha256": "4e7303d04d0b26c10eaf9413450edbf904e46d32b67c6de3bb75a8e416b5ecba",
      "outcome": "accepted",
      "issues": []
    },
    {
      "packetId": "RWP-0031",
      "fragmentSha256": "4178be1a155d02cf922c431d1de6e123f86b0e44acd1c14272c1acc721623bf1",
      "outcome": "accepted",
      "issues": []
    },
    {
      "packetId": "RWP-0032",
      "fragmentSha256": "08e4b9a938519a73764e10f759b13b978e497695c3d44ffa4428c69d2db3dc64",
      "outcome": "accepted",
      "issues": []
    },
    {
      "packetId": "RWP-0033",
      "fragmentSha256": "ab62ffe471f21f294900759063dcadfa8d812ad374be52750b7d702f93fc1a37",
      "outcome": "accepted",
      "issues": []
    },
    {
      "packetId": "RWP-0034",
      "fragmentSha256": "1d7439016b8ff169fb534f75efa2e17ee6ad094ccac07128df62a77000ba8530",
      "outcome": "accepted",
      "issues": []
    },
    {
      "packetId": "RWP-0035",
      "fragmentSha256": "3f21b0e959a85d8b6f9617be29f6bdb78c9ddf61df80aa9912256c8d02850d05",
      "outcome": "accepted",
      "issues": []
    },
    {
      "packetId": "RWP-0036",
      "fragmentSha256": "bc9181acc0e219a0bc7757063c4c5e3ce8bbb3645ec3e75e8a862088880e3cba",
      "outcome": "accepted",
      "issues": []
    },
    {
      "packetId": "RWP-0037",
      "fragmentSha256": "347b046a91e1ac1486c3f2597b1356778bec49b83a95ea62c8f6138ee49fd8a1",
      "outcome": "accepted",
      "issues": []
    },
    {
      "packetId": "RWP-0038",
      "fragmentSha256": "e9be71be2a388a226f172469693587773724e5d49958c7fd603e051ada139861",
      "outcome": "accepted",
      "issues": []
    },
    {
      "packetId": "RWP-0039",
      "fragmentSha256": "56af39ffd9525eb63b645e7e92b4016bf18668ea7bdab21f68632241dbd14827",
      "outcome": "accepted",
      "issues": []
    },
    {
      "packetId": "RWP-0040",
      "fragmentSha256": "cbd5d2a09b82d1f500cbc77efefdbe284f9ca894d55fd63ce8efb3ee77935139",
      "outcome": "accepted",
      "issues": []
    },
    {
      "packetId": "RWP-0041",
      "fragmentSha256": "f02392a112e774caba52da6c6a3e519803acf8cf9136c5213c9382908d3e6d21",
      "outcome": "accepted",
      "issues": []
    },
    {
      "packetId": "RWP-0042",
      "fragmentSha256": "fdc0e5990f17a6d461cacfdb006468f5c714884490513db66609071ec543387e",
      "outcome": "accepted",
      "issues": []
    },
    {
      "packetId": "RWP-0043",
      "fragmentSha256": "96946a32418258f5aaf59f3819ae88ed48eac4e6e4171fbb1f1f16719e9e1e42",
      "outcome": "accepted",
      "issues": []
    },
    {
      "packetId": "RWP-0044",
      "fragmentSha256": "b3810e520ced57d7adbd3991cec4b50fe22aa8032196f16ca15e3566ffab28aa",
      "outcome": "accepted",
      "issues": []
    },
    {
      "packetId": "RWP-0045",
      "fragmentSha256": "0e123994e2faca6a07f1bb02c13485b2ed3c1a6b4f6b874f6e573435ccf88848",
      "outcome": "accepted",
      "issues": []
    },
    {
      "packetId": "RWP-0046",
      "fragmentSha256": "486687b8cb1301cd150ae9ee8e283d936326fad06a9a6362eb4f20c946838831",
      "outcome": "accepted",
      "issues": []
    },
    {
      "packetId": "RWP-0047",
      "fragmentSha256": "d9dda382fb6243f0a2749e35bf9d3de7f9944337f15e853391235befd6601645",
      "outcome": "accepted",
      "issues": []
    },
    {
      "packetId": "RWP-0048",
      "fragmentSha256": "f48aab52e07c2d0c76405a7b31569cc91ef253c431dcdec288928faf76c41adf",
      "outcome": "accepted",
      "issues": []
    },
    {
      "packetId": "RWP-0049",
      "fragmentSha256": "19578381de69b036f0520b7a98bc170e32a5f66fdb888a5c7dda5007aa8b9786",
      "outcome": "accepted",
      "issues": []
    },
    {
      "packetId": "RWP-0050",
      "fragmentSha256": "13f6552b2570d6f7dd5d5fbb503711b0a73a9b1e7ed43a917cbd80119b9ab0da",
      "outcome": "accepted",
      "issues": []
    },
    {
      "packetId": "RWP-0051",
      "fragmentSha256": "26a8f014157916f809a75ddfbd27a9fd1b06d78ae3db6c4b853ca496ca730ec4",
      "outcome": "accepted",
      "issues": []
    },
    {
      "packetId": "RWP-0052",
      "fragmentSha256": "96ed17e6e51208f4ec5d05ac08e693876c38a6bcde958715a8c7e526462a4816",
      "outcome": "accepted",
      "issues": []
    },
    {
      "packetId": "RWP-0053",
      "fragmentSha256": "8d4623bc5f61331de5f4c221c8aef6ae744ef06bd192b48a2e25e25c0bc07ec8",
      "outcome": "accepted",
      "issues": []
    },
    {
      "packetId": "RWP-0054",